{
  "name": "aidd-codex-fixture",
  "version": "1.0.0",
  "description": "Codex fixture plugin for testing skill rewrite, agent TOML conversion, and byte-for-byte copy.",
  "author": { "name": "Test Author" },
  "homepage": "https://example.com",
  "repository": "https://github.com/example/aidd-codex-fixture",
  "license": "MIT",
  "keywords": ["test", "codex"]
}
