{
  "name": "aidd-context",
  "description": "Knowledge production: project bootstrap, project init, generation of context artifacts (skills, agents, rules, commands, hooks), mermaid diagrams, learn, explore, recipe how-to sheets",
  "version": "2.7.0",
  "author": {
    "name": "AI-Driven Dev",
    "url": "https://github.com/ai-driven-dev"
  },
  "homepage": "https://ai-driven.dev",
  "repository": "https://github.com/ai-driven-dev/framework",
  "license": "MIT",
  "keywords": [
    "context",
    "bootstrap",
    "explore",
    "skills",
    "mermaid",
    "onboard"
  ],
  "skills": [
    "./skills/00-onboard",
    "./skills/01-bootstrap",
    "./skills/02-project-memory",
    "./skills/03-context-generate",
    "./skills/04-skill-generate",
    "./skills/05-rule-generate",
    "./skills/06-agent-generate",
    "./skills/07-command-generate",
    "./skills/08-hook-generate",
    "./skills/09-mermaid",
    "./skills/10-learn",
    "./skills/11-explore",
    "./skills/12-cook"
  ],
  "hooks": "./hooks/hooks.json"
}
