{
  "$schema": "https://json.schemastore.org/claude-code-plugin-manifest.json",
  "name": "aidd-telemetry",
  "version": "0.4.0",
  "description": "Measurement: counts the tokens of Claude Code and Codex sessions per task, ticket, model, tool and day, locally. Opt in with the 00-init skill; ask with 01-usage.",
  "author": {
    "name": "AI-Driven Dev",
    "url": "https://github.com/ai-driven-dev"
  },
  "keywords": [
    "telemetry",
    "measurement"
  ],
  "repository": "https://github.com/ai-driven-dev/framework",
  "homepage": "https://ai-driven.dev",
  "license": "MIT"
}
